id,submitter,authors,title,comments,journal-ref,doi,report-no,categories,license,abstract,versions,update_date,authors_parsed,extracted_entities,assigned_concept,matched_keyword,similarity_score
2503.06480,Pankaj Popli,"Pankaj Popli, Ananyo Maitra, and Sriram Ramaswamy","Don't look back: Ordering and defect cloaking in non-reciprocal lattice
  XY models",,,,,cond-mat.soft cond-mat.stat-mech,http://creativecommons.org/licenses/by-nc-sa/4.0/,"  We present a detailed analytical and numerical examination, on square and
triangular lattices, of the non-reciprocal planar spin model introduced in
Dadhichi et al., Phys. Rev. E 101, 052601 (2020). We show that in principle the
effect of lattice anisotropy should persist at large scales, leading to a
''mass'' for the angle field of the spins, and behaviour not in the
''Malthusian Toner-Tu'' universality class. Numerically, however, we find
power-law scaling of long-wavelength equal-time correlators in the
polar-ordered phase of our lattice model. The mass, if present, is very small.
Focussing on topological defects, we show numerically that defect interactions
are highly anisotropic with respect to the mean ordering direction. In
particular, the constituents of a $\pm 1$ pair are shielded from each other in
a class of configurations, deferring their annihilation and allowing time for
the nucleation of further defects. The result, we show numerically, is the
destruction of the polarised phase via an aster apocalypse reminiscent of that
found by Besse et al., Phys. Rev. Lett. 129, 268003 (2022), for the Malthusian
Toner-Tu equation.
","[{'version': 'v1', 'created': 'Sun, 9 Mar 2025 06:37:34 GMT'}]",2025-03-11,"[['Popli', 'Pankaj', ''], ['Maitra', 'Ananyo', ''], ['Ramaswamy', 'Sriram', '']]","[{'text': 'power-law scaling', 'label': 'Scaling law'}]",Scaling law,power-law scaling,0.7775874137878418
