id,submitter,authors,title,comments,journal-ref,doi,report-no,categories,license,abstract,versions,update_date,authors_parsed,extracted_entities,assigned_concept,matched_keyword,similarity_score
2503.15245,Paola Ragonese,"Paola Ragonese, Chiara Maurizio, Boris Kalinic, Thomas Kirchartz,
  Sandheep Ravishankar","Determination of Electron Extraction in Semiconductor Photoanodes:
  Steady-state and Small-perturbation Response","26 pages, 12 figures",,,,cond-mat.mtrl-sci physics.app-ph,http://creativecommons.org/licenses/by/4.0/,"  This work develops an analytical model to consistently interpret the
steady-state and small-perturbation response (both in the time and frequency
domain) of photoanodes for solar water-splitting. In addition to accounting for
the fundamental mechanisms of charge-carrier generation, recombination and slow
hole transfer at the photoanode/electrolyte interface, the model overcomes the
key shortcomings of existing models in the literature. These include
consistency across measurements/bias conditions and the non-consideration of
imperfect electron extraction at the collecting contact and its corresponding
effect on the recombination rate in the bulk. We applied the model to analyse
the time constants obtained from intensity-modulated photocurrent (IMPS) and
photovoltage (IMVS) measurements of a hematite photoanode, obtaining an
electron extraction velocity of 100 cm/s close to the 1 sun open-circuit
potential, that corresponds to an electron mobility of 0.022 cm2V-1s-1. The
model further predicts a linear dependence of the photocurrent versus anodic
voltage, an observation whose origin has been strongly debated in the
literature in the case of hematite photoanodes. The generality of the model
allows its extension to other photoanodes and photovoltaic systems, by the
addition or removal of specific physical mechanisms.
","[{'version': 'v1', 'created': 'Wed, 19 Mar 2025 14:22:09 GMT'}]",2025-03-20,"[['Ragonese', 'Paola', ''], ['Maurizio', 'Chiara', ''], ['Kalinic', 'Boris', ''], ['Kirchartz', 'Thomas', ''], ['Ravishankar', 'Sandheep', '']]","[{'text': 'model', 'label': 'AI model'}, {'text': 'model', 'label': 'AI model'}, {'text': 'model', 'label': 'AI model'}, {'text': 'model', 'label': 'AI model'}, {'text': 'model', 'label': 'AI model'}]",AI model,model,0.6292717456817627
2503.15339,Peter R. Wiecha,"Abdourahman Khaireh-Walieh, Alexandre Arnoult, S\'ebastien Plissard,
  Peter R. Wiecha","Data-driven Azimuthal RHEED construction for in-situ crystal growth
  characterization","7 pages, 6 figures",,,,cond-mat.mes-hall cond-mat.mtrl-sci,http://arxiv.org/licenses/nonexclusive-distrib/1.0/,"  Reflection High-Energy Electron Diffraction (RHEED) is a powerful tool to
probe the surface reconstruction during MBE growth. However, raw RHEED patterns
are difficult to interpret, especially when the wafer is rotating. A more
accessible representation of the information is therefore the so-called
Azimuthal RHEED (ARHEED), an angularly resolved plot of the electron
diffraction pattern during a full wafer rotation. However, ARHEED requires
precise information about the rotation angle as well as of the position of the
specular spot of the electron beam. We present a Deep Learning technique to
automatically construct the Azimuthal RHEED from bare RHEED images, requiring
no further measurement equipment. We use two artificial neural networks: an
image segmentation model to track the center of the specular spot and a
regression model to determine the orientation of the crystal with respect to
the incident electron beam of the RHEED system. Our technique enables accurate
and real-time ARHEED construction on any growth chamber equipped with a RHEED
system.
","[{'version': 'v1', 'created': 'Wed, 19 Mar 2025 15:35:29 GMT'}]",2025-03-20,"[['Khaireh-Walieh', 'Abdourahman', ''], ['Arnoult', 'Alexandre', ''], ['Plissard', 'Sébastien', ''], ['Wiecha', 'Peter R.', '']]","[{'text': 'image segmentation model', 'label': 'AI model'}, {'text': 'regression model', 'label': 'AI model'}]",AI model,regression model,0.5078941583633423
2503.15477,Noam Razin,"Noam Razin, Zixuan Wang, Hubert Strauss, Stanley Wei, Jason D. Lee,
  Sanjeev Arora",What Makes a Reward Model a Good Teacher? An Optimization Perspective,Code available at https://github.com/princeton-pli/what-makes-good-rm,,,,cs.LG cs.AI cs.CL stat.ML,http://arxiv.org/licenses/nonexclusive-distrib/1.0/,"  The success of Reinforcement Learning from Human Feedback (RLHF) critically
depends on the quality of the reward model. While this quality is primarily
evaluated through accuracy, it remains unclear whether accuracy fully captures
what makes a reward model an effective teacher. We address this question from
an optimization perspective. First, we prove that regardless of how accurate a
reward model is, if it induces low reward variance, then the RLHF objective
suffers from a flat landscape. Consequently, even a perfectly accurate reward
model can lead to extremely slow optimization, underperforming less accurate
models that induce higher reward variance. We additionally show that a reward
model that works well for one language model can induce low reward variance,
and thus a flat objective landscape, for another. These results establish a
fundamental limitation of evaluating reward models solely based on accuracy or
independently of the language model they guide. Experiments using models of up
to 8B parameters corroborate our theory, demonstrating the interplay between
reward variance, accuracy, and reward maximization rate. Overall, our findings
highlight that beyond accuracy, a reward model needs to induce sufficient
variance for efficient optimization.
","[{'version': 'v1', 'created': 'Wed, 19 Mar 2025 17:54:41 GMT'}]",2025-03-20,"[['Razin', 'Noam', ''], ['Wang', 'Zixuan', ''], ['Strauss', 'Hubert', ''], ['Wei', 'Stanley', ''], ['Lee', 'Jason D.', ''], ['Arora', 'Sanjeev', '']]","[{'text': 'Reinforcement Learning from Human Feedback', 'label': 'Few-shot Learning'}, {'text': 'reward model', 'label': 'AI model'}, {'text': 'reward\nmodel', 'label': 'AI model'}, {'text': 'reward model', 'label': 'AI model'}]",AI model,reward model,0.548200249671936
2503.15691,Jingyuan Chen Ph.D.,"Jingyuan Chen, Yunze Yang, Chenbin Liu, Hongying Feng, Jason M.
  Holmes, Lian Zhang, Steven J. Frank, Charles B. Simone II, Daniel J. Ma,
  Samir H. Patel, Wei Liu","Critical review of patient outcome study in head and neck cancer
  radiotherapy",,,,,physics.med-ph,http://creativecommons.org/licenses/by-nc-sa/4.0/,"  Rapid technological advances in radiation therapy have significantly improved
dose delivery and tumor control for head and neck cancers. However,
treatment-related toxicities caused by high-dose exposure to critical
structures remain a significant clinical challenge, underscoring the need for
accurate prediction of clinical outcomes-encompassing both tumor control and
adverse events (AEs). This review critically evaluates the evolution of
data-driven approaches in predicting patient outcomes in head and neck cancer
patients treated with radiation therapy, from traditional dose-volume
constraints to cutting-edge artificial intelligence (AI) and causal inference
framework. The integration of linear energy transfer in patient outcomes study,
which has uncovered critical mechanisms behind unexpected toxicity, was also
introduced for proton therapy. Three transformative methodological advances are
reviewed: radiomics, AI-based algorithms, and causal inference frameworks.
While radiomics has enabled quantitative characterization of medical images, AI
models have demonstrated superior capability than traditional models. However,
the field faces significant challenges in translating statistical correlations
from real-world data into interventional clinical insights. We highlight that
how causal inference methods can bridge this gap by providing a rigorous
framework for identifying treatment effects. Looking ahead, we envision that
combining these complementary approaches, especially the interventional
prediction models, will enable more personalized treatment strategies,
ultimately improving both tumor control and quality of life for head and neck
cancer patients treated with radiation therapy.
","[{'version': 'v1', 'created': 'Wed, 19 Mar 2025 21:01:33 GMT'}]",2025-03-21,"[['Chen', 'Jingyuan', ''], ['Yang', 'Yunze', ''], ['Liu', 'Chenbin', ''], ['Feng', 'Hongying', ''], ['Holmes', 'Jason M.', ''], ['Zhang', 'Lian', ''], ['Frank', 'Steven J.', ''], ['Simone', 'Charles B.', 'II'], ['Ma', 'Daniel J.', ''], ['Patel', 'Samir H.', ''], ['Liu', 'Wei', '']]","[{'text': 'AI\nmodels', 'label': 'AI model'}]",AI model,"AI
models",0.9476590752601624
2503.16061,Hossein Safi,"Asim Ihsan, Muhammad Asif, Hossein Safi, Iman Tavakkolnia, and Harald
  Haas","Efficient Service Differentiation and Energy Management in Hybrid
  WiFi/LiFi Networks","28 pages, 9 figures",,,,math.OC,http://creativecommons.org/licenses/by/4.0/,"  In this paper, we propose an innovative predict-and-optimize algorithm
designed for hybrid WiFi/LiFi networks, aiming to achieve service
differentiation while maximizing energy efficiency (EE). The proposed framework
utilizes multi-access technology real-time intelligent controller (mATRIC) to
dynamically predict the appropriate network slice for each user based on
historically monitored key performance indicators (KPIs). This prediction is
facilitated by a deep learning model trained using the resilient
backpropagation algorithm, with training conducted on KPIs data at the
universal non-real time RAN intelligent controller (non-RT RIC). This trained
model enables real-time slice selection by mATRIC. In the subsequent phase, the
algorithm focuses on optimizing EE of hybrid network as a function of precoding
vectors for the predicted slices by employing techniques from sequential convex
approximation and the inner approximation method. We introduce novel
approximations to convert non-convex objective functions and constraints into
convex forms, and develop an iterative algorithm to achieve sub-optimal
solutions. Additionally, the EE maximization problem, ensures alignment with
end-to-end latency requirements. It also addresses the various constraints
inherent to hybrid systems, such as input signal limitations for LiFi LEDs,
data rate restrictions, and power budget considerations. Simulation results
validate the effectiveness of the proposed algorithm, demonstrating significant
improvements in EE while ensuring service differentiation within hybrid network
environments.
","[{'version': 'v1', 'created': 'Thu, 20 Mar 2025 11:47:29 GMT'}]",2025-03-21,"[['Ihsan', 'Asim', ''], ['Asif', 'Muhammad', ''], ['Safi', 'Hossein', ''], ['Tavakkolnia', 'Iman', ''], ['Haas', 'Harald', '']]","[{'text': 'deep learning model', 'label': 'AI model'}]",AI model,deep learning model,0.601271390914917
